{
  "artifact_id": "K501-AIONARC-INTEGRATED-PIPELINE-PROOF-RUNTIME",
  "classification": "DERIVED_NAVIGATION_METADATA",
  "entries": [
    {
      "bytes": 195,
      "path": ".gitignore",
      "sha256": "786fb3bf921a720dc96f9127c3e97dc6d301781c3356d47339d17c2191cf27ff"
    },
    {
      "bytes": 1402,
      "path": "CHANGELOG.md",
      "sha256": "54f9f0e727d36e35c825002044042178e82a4c2728606a5e92724f3e0c767e61"
    },
    {
      "bytes": 662,
      "path": "CITATION.cff",
      "sha256": "134ee8dda4bc8beb6369eb0ef577da509b00db1ac827bcb7157d0134ab7bd897"
    },
    {
      "bytes": 5744,
      "path": "Gateway.json",
      "sha256": "a33c2a52758e500771f4d5f2d241d3b1a2d72ec7b027e4443f2244aa770b905c"
    },
    {
      "bytes": 4197,
      "path": "Gateway.md",
      "sha256": "a89f14dcfcefab706dc171897079c54a10ac5c9a390798d231511ecb2773d501"
    },
    {
      "bytes": 1334,
      "path": "LICENSE",
      "sha256": "e900d717ffb148018af97a07caf38078afbe1cf16efc09beb978cbd5c76e6335"
    },
    {
      "bytes": 67783,
      "path": "LICENSES/AGGREGATE_FILE_LICENSE_MAP.csv",
      "sha256": "8bc1ed2969fe391ec69826092d31560ab08d0541c5e46f5258c3e07c92ec894c"
    },
    {
      "bytes": 104476,
      "path": "LICENSES/AGGREGATE_FILE_LICENSE_MAP.json",
      "sha256": "720f941ad94010a058c14ea410cf625e41bd6b072fb6e7de9758083f6be891ec"
    },
    {
      "bytes": 18112,
      "path": "LICENSES/CC-BY-4.0.txt",
      "sha256": "675181506508b5e2506ab194fdac5b0fa74585342ec05eaaab1ed9e86c06a9b1"
    },
    {
      "bytes": 1078,
      "path": "LICENSES/MIT.txt",
      "sha256": "56e6d389ad4fad938d2d21877854de011775ddd9f90874d08f2622605bffc0c7"
    },
    {
      "bytes": 1462,
      "path": "LICENSES/RIGHTSHOLDER_ATTESTATION.md",
      "sha256": "e7b286422d3d90ec9cff92b32770c88887042d769891594e85719f12da69956e"
    },
    {
      "bytes": 1722,
      "path": "LICENSE_SCOPE.md",
      "sha256": "4d5c32e46f0bb9f79b9c522af7485dd898f1fc61be40a914da3ca77d0595bd15"
    },
    {
      "bytes": 1146,
      "path": "LICENSE_STATUS.md",
      "sha256": "aa6c14d6d943b8baf3046bfa0b2d19c1823efa4db13276fd88314a29b69e1d70"
    },
    {
      "bytes": 1298,
      "path": "Makefile",
      "sha256": "b71e63f6b7f0e43847e429d2b672ccfa6d3d3eced071d44bd839957495bb5be2"
    },
    {
      "bytes": 555,
      "path": "NOTICE",
      "sha256": "1ca034a88764a035546df19a3e576eb7d81d319a034890e9e2d0259cea235851"
    },
    {
      "bytes": 4989,
      "path": "README.md",
      "sha256": "1647ba8f4af991b7f07c0e21c364baff09ccaa8e8112cc0fdd2e1c25f6d5df4c"
    },
    {
      "bytes": 1408,
      "path": "STATUS.md",
      "sha256": "b6fdc70c4d685ecfb9bb9f6e46ac50f449fb62802704d1f9dcb57c137e1e3b75"
    },
    {
      "bytes": 6,
      "path": "VERSION",
      "sha256": "76120c1f2c4311c2154c22a6b58e00e411e0ebe76afae0daf608d9196c61f114"
    },
    {
      "bytes": 82,
      "path": "components/K501-AIONARC-Pipeline/.gitignore",
      "sha256": "626e630c73ac4219c395f9d56c38a3c1da554f0e5cb36cb8c1af1136876d0ac1"
    },
    {
      "bytes": 3551,
      "path": "components/K501-AIONARC-Pipeline/Gateway.json",
      "sha256": "bab7eed63c9d4a9fbb44a5cb705e1f457a2290850c9a4889c59ce500f98156a5"
    },
    {
      "bytes": 1984,
      "path": "components/K501-AIONARC-Pipeline/Gateway.md",
      "sha256": "c85b613342ebe7840c2a13e484da4a1ff7f9ee5ad28207a0d40ce1b7d2f555c0"
    },
    {
      "bytes": 24685,
      "path": "components/K501-AIONARC-Pipeline/Index.json",
      "sha256": "7777218aec5ddf4c79c304f0a640547df065894b45ebb05305dce4ec64b61574"
    },
    {
      "bytes": 15838,
      "path": "components/K501-AIONARC-Pipeline/Index.md",
      "sha256": "a192f16130ab8a239707a04faa2d6b8856d5a29d802f398af3450dd18c7b5230"
    },
    {
      "bytes": 1573,
      "path": "components/K501-AIONARC-Pipeline/LICENSE",
      "sha256": "67edb9c974d23fce8050d5a7378a9d57b816a85256c8b6e08483854f19d4f87d"
    },
    {
      "bytes": 18112,
      "path": "components/K501-AIONARC-Pipeline/LICENSES/CC-BY-4.0.txt",
      "sha256": "675181506508b5e2506ab194fdac5b0fa74585342ec05eaaab1ed9e86c06a9b1"
    },
    {
      "bytes": 17967,
      "path": "components/K501-AIONARC-Pipeline/LICENSES/FILE_LICENSE_MAP.csv",
      "sha256": "e84b477e3aa8b633d2df0d469710de452a77fece2912b922d819b91606bbbd59"
    },
    {
      "bytes": 810,
      "path": "components/K501-AIONARC-Pipeline/LICENSES/FILE_LICENSE_MAP.md",
      "sha256": "96bccd671250c371dfb0eafcbfbfb6b74872b0f5b68afcfe37659512db3745bd"
    },
    {
      "bytes": 809,
      "path": "components/K501-AIONARC-Pipeline/LICENSES/K501_LICENSE_POLICY_V1.0.md",
      "sha256": "760e801cd065945da1b65cb0d666960517068bf8777e4b486b7262ca483c99e0"
    },
    {
      "bytes": 875,
      "path": "components/K501-AIONARC-Pipeline/LICENSES/LICENSE_REVIEW_CHECKLIST.md",
      "sha256": "101e7ce5ac4afa5b94b4f62394b87548016c07eb473008408201ed00d0ceef38"
    },
    {
      "bytes": 660,
      "path": "components/K501-AIONARC-Pipeline/LICENSES/LICENSE_TRANSITION_NOTICE.md",
      "sha256": "63277e815c44707a72ffea11a57933767dfd5b8888de45afbb50995abb6047de"
    },
    {
      "bytes": 1087,
      "path": "components/K501-AIONARC-Pipeline/LICENSES/MIT.txt",
      "sha256": "31d37ce92982543a5efb22b8c4f200bfabc635303a3fb211e69646c8951edb68"
    },
    {
      "bytes": 1308,
      "path": "components/K501-AIONARC-Pipeline/LICENSES/QH256_EXISTING_LICENSE_REFERENCE.md",
      "sha256": "e4569590b3a6cb7ceb47f2a380d2f579fbd0b1818a312550ee13bf97cc898e17"
    },
    {
      "bytes": 942,
      "path": "components/K501-AIONARC-Pipeline/LICENSES/RIGHTSHOLDER_DECLARATION.md",
      "sha256": "d2d96260de99dd04963054825dfc9e93b225b9dee83f0a6e96849c239bd7f5a0"
    },
    {
      "bytes": 661,
      "path": "components/K501-AIONARC-Pipeline/LICENSES/THIRD_PARTY_NOTICES.md",
      "sha256": "50af11b966d8d83638ef9894c569c76f2cd2b3963e733c725c6b22207d50fbbc"
    },
    {
      "bytes": 1017,
      "path": "components/K501-AIONARC-Pipeline/LICENSE_SCOPE.md",
      "sha256": "f73705aedb1df98538a35eb0311fa02c3771abc0cb73103002d42735aecf3be5"
    },
    {
      "bytes": 1192,
      "path": "components/K501-AIONARC-Pipeline/LICENSE_STATUS.md",
      "sha256": "dc7b995fc6238327508c28a80530fec78357d499d39753208fd3705d4016d1d8"
    },
    {
      "bytes": 18221,
      "path": "components/K501-AIONARC-Pipeline/MANIFEST.json",
      "sha256": "71b5d397cdfc75224dbe48256ccf1ff42e29a8a4afcd6599f06866dc7a54bd63"
    },
    {
      "bytes": 692,
      "path": "components/K501-AIONARC-Pipeline/NOTICE",
      "sha256": "a772222f68facbcae6920a4a99b12a91c4e9c26d30317722c006554637e6e39b"
    },
    {
      "bytes": 3163,
      "path": "components/K501-AIONARC-Pipeline/README.md",
      "sha256": "91015cc0b160595c582b51d2af94dd9e9c5e5619ae993576c2844a05839b6c4f"
    },
    {
      "bytes": 11487,
      "path": "components/K501-AIONARC-Pipeline/SHA256SUMS.txt",
      "sha256": "455655cc68f89a0c4927f9137e6f06574334910df3a0304213f96fed37cf8339"
    },
    {
      "bytes": 81,
      "path": "components/K501-AIONARC-Pipeline/SHA256SUMS.txt.sha256",
      "sha256": "812ac37ddb41d6ff24466d8bbae82c8e71c2711cd1cad9f0c9f9ff5362e3cbae"
    },
    {
      "bytes": 1329,
      "path": "components/K501-AIONARC-Pipeline/docs/OPERATOR_MANUAL.md",
      "sha256": "6359cc2411a5a9b49c23125ef9230c6cadddd0ca007abd7fe83f1a6bca627b5b"
    },
    {
      "bytes": 1070,
      "path": "components/K501-AIONARC-Pipeline/docs/PROJECT_BOUNDARY.md",
      "sha256": "f273e41d460d3166482867c4c7a517e8aaca4359f070603dcb32f68781645567"
    },
    {
      "bytes": 1706,
      "path": "components/K501-AIONARC-Pipeline/frames/FRAME_000_BOOTSTRAP.json",
      "sha256": "f28ade2bc17da14d0a50b6549b2b447aa6422dadb963f150cd0f3e9831314580"
    },
    {
      "bytes": 1185,
      "path": "components/K501-AIONARC-Pipeline/frames/FRAME_000_BOOTSTRAP.md",
      "sha256": "6411b52143828209f494a7b9e84bcdabddb0e46e9842a533a436bbe00452a5b9"
    },
    {
      "bytes": 2569,
      "path": "components/K501-AIONARC-Pipeline/frames/FRAME_001_PACKAGE_IMPORT.json",
      "sha256": "ce4ee9ed8f512f1ed2b054199a02c6df6b5b5865c76de90abbcdde18bc2a1e8f"
    },
    {
      "bytes": 2060,
      "path": "components/K501-AIONARC-Pipeline/frames/FRAME_001_PACKAGE_IMPORT.md",
      "sha256": "2384c44ac662e5bd2c6cfe14dbdb9984c1f72d9bfd840baca84247c113b5c749"
    },
    {
      "bytes": 592,
      "path": "components/K501-AIONARC-Pipeline/metadata/release-manifest.template.json",
      "sha256": "cb5e80380010d09dd3812dd9335a0f0094e83786f869c67b9aa7cde7654f2933"
    },
    {
      "bytes": 5610,
      "path": "components/K501-AIONARC-Pipeline/metadata/repository.json",
      "sha256": "eadc6fc38221da67b8de46cffad07cb7d22332b1425c117612d90283f60c0c30"
    },
    {
      "bytes": 3130,
      "path": "components/K501-AIONARC-Pipeline/metadata/source-archive-records.json",
      "sha256": "73fb5faaeb2942fc26482b1488fd576d1058a16401e575fcb25f37f91b4ae6ce"
    },
    {
      "bytes": 1748,
      "path": "components/K501-AIONARC-Pipeline/payload/K501_AIONARC_Pipeline_v3.0.0_AI_Memory_Runtime_C_alpha.1/CHANGELOG.md",
      "sha256": "2f2b0563e7202f6f49fa38ae8af90c916322097ed252577b4c694f74d34137ae"
    },
    {
      "bytes": 656,
      "path": "components/K501-AIONARC-Pipeline/payload/K501_AIONARC_Pipeline_v3.0.0_AI_Memory_Runtime_C_alpha.1/CITATION.cff",
      "sha256": "1b514adbf1f6b3f49345d7a9915da065d4696abf15d6f1097122874d5011523a"
    },
    {
      "bytes": 2174,
      "path": "components/K501-AIONARC-Pipeline/payload/K501_AIONARC_Pipeline_v3.0.0_AI_Memory_Runtime_C_alpha.1/CODE_OF_CONDUCT.md",
      "sha256": "c53df751bc30441fa40d7d58d0a5576945aa46565731e83122f80fa2490ee28c"
    },
    {
      "bytes": 1087,
      "path": "components/K501-AIONARC-Pipeline/payload/K501_AIONARC_Pipeline_v3.0.0_AI_Memory_Runtime_C_alpha.1/LICENSE",
      "sha256": "31d37ce92982543a5efb22b8c4f200bfabc635303a3fb211e69646c8951edb68"
    },
    {
      "bytes": 947,